{
  "manifestVersion": "1",
  "key": "send-email",
  "type": "perform",
  "title": "Send Email",
  "description": "Send a transactional email.",
  "params": [
    { "key": "to", "label": "To", "type": "string", "required": true },
    { "key": "from", "label": "From", "type": "string", "required": true },
    { "key": "subject", "label": "Subject", "type": "string", "required": true },
    { "key": "body", "label": "Body", "type": "text", "required": true },
    {
      "key": "apiBase",
      "label": "API base URL",
      "type": "string",
      "default": "https://api.sendgrid.com",
      "hint": "Overridable so tests can point at a local endpoint."
    }
  ],
  "execute": "./send-email.ts",
  "output": [
    { "key": "status", "type": "number", "label": "HTTP status" }
  ]
}
